{
  "id": "global-chains",
  "type": "chain-dataset",
  "version": 1,
  "items": [
    {
      "id": "mcdonalds",
      "canonicalName": "McDonald's",
      "match": {
        "aliases": ["mc donalds", "mcdonalds", "mcdonald's"],
        "regex": ["^mc\\s?donald'?s$"],
        "categoryAnyOf": ["FAST_FOOD", "RESTAURANT"]
      },
      "standard": {
        "name": "McDonald's",
        "brand": "McDonald's",
        "categories": ["FAST_FOOD"],
        "description": "",
        "url": "",
        "aliases": [],
        "optionalAliases": [],
        "services": ["TAKEAWAY", "DINE_IN"],
        "openingHoursTemplate": null,
        "externalProviderIds": []
      },
      "policy": {
        "geometry": {
          "recommended": "point",
          "allowed": ["point", "polygon"]
        },
        "lockLevel": 3,
        "requirePhone": true,
        "requireUrl": true,
        "requireOpeningHours": false,
        "requireExternalProvider": false,
        "services": {
          "required": [],
          "recommended": ["DRIVETHROUGH"],
          "forbidden": []
        }
      },
      "scope": {
        "level": "global"
      },
      "meta": {
        "description": "Global chain definition for McDonald's"
      }
    }
  ]
}